{
  "schema_family": "policy-evaluation-result",
  "schema_version": "v0",
  "policy": {
    "id": "no-critical-vulnerabilities",
    "name": "No Critical Vulnerabilities",
    "version": "v1",
    "category": "security"
  },
  "evaluation": {
    "status": "failed",
    "enforcement_level": "critical",
    "reason": "Critical vulnerability count exceeds the allowed threshold of 0.",
    "evaluated_at": "2026-03-21T11:05:00Z",
    "evidence_refs": [
      {
        "kind": "severity-rollup",
        "ref": "severity_rollup",
        "field": "critical"
      },
      {
        "kind": "normalized-result",
        "ref": "normalized-result/v0:security-scan:trivy"
      }
    ],
    "metadata": {
      "threshold": 0,
      "observed": 2
    }
  }
}